user_id,feedback
user_id,feedback
user1,This system is frustrating and slow.
user2,I love how smooth and fast everything is.
user4,The design is clean and user-friendly.
user5,I faced some issues logging in today.
user6,Fast and responsive application.
user7,The system crashes occasionally.
user8,Very helpful for my daily workflow.
user9,Needs better error messages.
user10,Great UI but lacks personalization.
user11,Search function is not accurate.
user12,I love how intuitive the navigation is.
user13,It’s very slow during peak hours.
user14,Perfect tool for project tracking.
user15,Notifications are not reliable.
user16,Could use a dark mode option.
user17,Too many popups on the dashboard.
user18,Support team is very responsive.
user19,I had trouble uploading files.
user20,Tasks load very quickly now.
user21,Mobile version needs improvements.
user22,I appreciate the analytics module.
user23,Feature set is impressive.
user24,Login page sometimes gets stuck.
user25,Easy to understand and use.
user26,Had to refresh several times.
user27,Would love keyboard shortcuts.
user28,Layout is too cluttered.
user29,The new update improved speed.
user30,Old data does not load sometimes.
user31,Feedback system is much better now.
user32,The fonts are too small on tablet.
user33,Good but needs offline support.
user34,Excellent experience overall.
user35,I noticed a bug in the task list.
user36,Please improve loading time.
user37,Everything works as expected.
user38,User settings aren’t saving.
user39,No issues at all. I’m happy.
user40,Needs better integration with calendar.
user41,I like the notifications panel.
user42,Couldn’t find the help section.
user43,It looks professional and clean.
user44,Glitch in the filter options.
user45,Reports take time to generate.
user46,It’s smooth and simple to use.
user47,Colors are too bright at night.
user48,I appreciate the weekly summary.
user49,Would be nice to customize layout.
user50,The update solved many bugs.
user51,I’m impressed with the latest improvements.
user52,App sometimes logs me out randomly.
user53,Clear instructions and help text.
user54,I like the auto-save feature.
user55,Data export failed for large files.
user56,Could not reset my password easily.
user57,Very useful for my team.
user58,Would love a tutorial on first use.
user59,Tooltips are really helpful.
user60,Found some inconsistencies in reports.
user61,Very fast and smooth experience.
user62,Still seeing some lag on mobile.
user63,Love the compact design.
user64,User permissions are difficult to manage.
user65,I wish the charts were more interactive.
user66,Works fine after recent patch.
user67,Filter options are confusing.
user68,App is good but lacks polish.
user69,I keep getting duplicate notifications.
user70,Documentation could be clearer.
user71,Impressed with the response time.
user72,The UI animations are slow.
user73,Calendar sync didn’t work.
user74,Email alerts are delayed.
user75,Easy to onboard new users.
user76,App is clean but feels too minimal.
user77,Getting better with every release.
user78,I like the theme customization.
user79,Multi-language support would help.
user80,Data import took too long.
user81,Everything just works. Nice!
user82,Was hard to find settings.
user83,Search results could be improved.
user84,I love the smart suggestions.
user85,App crashed during signup.
user86,Dark mode looks fantastic.
user87,Not compatible with my browser.
user88,Workflow setup is easy and flexible.
user89,Would love more integrations.
user90,Easy access to recent tasks is nice.
user91,I lost some unsaved changes.
user92,Login with Google worked fine.
user93,Tool is helpful for remote teams.
user94,Drag-and-drop feature is useful.
user95,Could use real-time collaboration.
user96,Onboarding process is smooth.
user97,I found the dashboard a bit overwhelming.
user98,Notifications need to be more visible.
user99,Analytics are detailed and useful.
user100,Fast updates and responsive dev team.




